{"adapters":[{"id":"adaptive-context-compiler","implementation_status":"contract-only","input_contract":"comparative-adapter-input/v1","output_contract":"comparative-task-ledger/v1"},{"id":"evidence-graph-only","implementation_status":"contract-only","input_contract":"comparative-adapter-input/v1","output_contract":"comparative-task-ledger/v1"},{"id":"graphify-pinned","implementation_status":"contract-only","input_contract":"comparative-adapter-input/v1","output_contract":"comparative-task-ledger/v1"},{"id":"grep-read","implementation_status":"contract-only","input_contract":"comparative-adapter-input/v1","output_contract":"comparative-task-ledger/v1"},{"id":"hybrid-retrieval","implementation_status":"contract-only","input_contract":"comparative-adapter-input/v1","output_contract":"comparative-task-ledger/v1"},{"id":"llm-wiki-current","implementation_status":"contract-only","input_contract":"comparative-adapter-input/v1","output_contract":"comparative-task-ledger/v1"}],"availability":{"gate_f_passed":false,"heavy_comparison_available":false,"reason":"Real comparative execution is unavailable until Gate F and complete paired evidence exist."},"fairness":{"enforcement":"reject-run-on-any-mismatch","identical_inputs":["commit","context_budget","hardware","model","repository","retry_policy","task"]},"metrics":{"latency_summary":["p50","p95"],"per_task_fields":["blinded_factual_correctness","cache_tokens","edge_precision","edge_recall","executable_task_success","freshness","incremental_time_ms","index_size_bytes","indexing_time_ms","peak_ram_bytes","query_latency_ms","retrieval_quality","uncached_input_tokens","uncached_output_tokens"],"unavailable_value":null},"provenance":{"configuration":{"id":"comparative-smoke-v1","sha256":"79b7fa8ebb60eff5c2bc7056b49e860e16c440aad75a05ce51f41db87043cdfb"},"dependencies":[],"graphify":{"commit":"cb96bdaa0c367bec8d5c5aee5d7c9ebb727e9780","dependency_lock":{"git_blob_sha1":"088ebbbdcb17eacec5b60541f290381f6adf33e7","path":"uv.lock"},"repository":"https://github.com/Graphify-Labs/graphify"},"model":{"id":"deterministic-fake/comparative-v1","provider":"offline-fake","revision":"comparative-smoke-v1"},"python":{"implementation":"CPython","version":"3.12.10"},"tokenizer":{"id":"utf8-bytes/v1","revision":"comparative-smoke-v1"}},"public_claim_gate":{"hard_gates":["crash","evidence","freshness"],"quality_lower_bound_basis_points_strictly_greater_than":-200,"requires_gate_f":true,"requires_real_evidence":true,"token_ratio_upper_bound_basis_points_strictly_less_than":9000},"schema_version":"comparative-contract/v1","smoke":{"adapter_kind":"deterministic-fake","attempts_per_adapter":1,"intentional_failure_adapter":"graphify-pinned","max_adapters":6,"max_tasks":1,"network_access":false},"statistics":{"confidence_level_basis_points":9500,"guidance":["https://docs.scipy.org/doc/scipy/reference/generated/scipy.stats.bootstrap.html","https://docs.scipy.org/doc/scipy/reference/generated/scipy.stats.permutation_test.html","https://www.acm.org/publications/policies/artifact-review-and-badging-current"],"interval_methods":["paired-bootstrap","paired-randomization"],"pairing_unit":"repository-commit-task-seed","resamples":10000,"seeds":[1729,2718,31415]},"tasks":[{"id":"smoke-contract-001","inputs":{"commit":"0000000000000000000000000000000000000000","context_budget":4096,"hardware":"deterministic-fake-hardware/v1","model":"deterministic-fake/comparative-v1@comparative-smoke-v1","repository":"synthetic://comparative-smoke-v1","retry_policy":{"backoff":"none","max_attempts":1},"task":"Validate the comparative adapter contract without evaluating retrieval quality."}}]}
